{
  "dataset_name": "medical_evidence_three_track_mixed_500",
  "version": "2.0.0",
  "status": "draft",
  "total_expected": 500,
  "allocation": {
    "track_1": 200,
    "track_2": 150,
    "track_3": 150
  },
  "questions": [
    {
      "id": "Q001",
      "question": "血脂异常通常如何诊断或筛查？哪些指标适合初步评估，哪些情况需要进一步检查？",
      "track": "track_1",
      "expected_evidence_type": "mixed",
      "notes": "通用型；题型：diagnosis；需检索多篇证据综合回答。",
      "should_abstain": false
    },
    {
      "id": "Q002",
      "question": "高甘油三酯血症一般有哪些治疗和生活方式管理方法？普通人应该怎样理解不同方法的作用？",
      "track": "track_2",
      "expected_evidence_type": "mixed",
      "notes": "通用型；题型：consumer_treatment；需检索多篇证据综合回答。",
      "should_abstain": false
    },
    {
      "id": "Q003",
      "question": "运动干预的长期依从性会如何影响研究结果和真实世界效果？",
      "track": "track_1",
      "expected_evidence_type": "mixed",
      "notes": "通用型；题型：adherence；需检索多篇证据综合回答。",
      "should_abstain": false
    },
    {
      "id": "Q004",
      "question": "关于肝纤维化，网络上常见的“可以快速治愈”说法靠谱吗？应怎样判断证据质量？",
      "track": "track_2",
      "expected_evidence_type": "mixed",
      "notes": "通用型；题型：myth；需检索多篇证据综合回答。",
      "should_abstain": false
    },
    {
      "id": "Q005",
      "question": "现有研究对妊娠期糖尿病后的代谢风险的治疗、预防和长期结局分别提供了哪些证据？",
      "track": "track_3",
      "expected_evidence_type": "mixed",
      "notes": "通用型；题型：evidence_summary；需检索多篇证据综合回答。",
      "should_abstain": false
    },
    {
      "id": "Q006",
      "question": "高甘油三酯血症在老年人、女性或合并其他慢性病的人群中，管理原则有哪些需要特别考虑的地方？",
      "track": "track_1",
      "expected_evidence_type": "mixed",
      "notes": "通用型；题型：special_population；需检索多篇证据综合回答。",
      "should_abstain": false
    },
    {
      "id": "Q007",
      "question": "甘油三酯/高密度脂蛋白比值与其他血脂或代谢指标相比，额外提供了多少临床信息？",
      "track": "track_1",
      "expected_evidence_type": "mixed",
      "notes": "通用型；题型：comparison；需检索多篇证据综合回答。",
      "should_abstain": false
    },
    {
      "id": "Q008",
      "question": "“Addition of Simvastatin to Standard Therapy for the Prevention of Variceal Rebleeding Does Not Reduce Rebleeding but Increases Survival in Patients With Cirrhosis”所涉及的可能生物学或临床机制是什么？请区分研究直接观察到的证据与作者提出的解释。",
      "track": "track_1",
      "expected_evidence_type": "other",
      "notes": "题型：mechanism；围绕单篇来源文献构造，评测时须核查证据边界。",
      "should_abstain": false
    },
    {
      "id": "Q009",
      "question": "在“Long-term prognostic utility of low-density lipoprotein (LDL) triglyceride in real-world patients with coronary artery disease and diabetes or prediabetes”相关研究中，研究采用了什么设计，比较了哪些因素或干预，并观察了哪些主要结局？",
      "track": "track_1",
      "expected_evidence_type": "other",
      "notes": "题型：study_design；围绕单篇来源文献构造，评测时须核查证据边界。",
      "should_abstain": false
    },
    {
      "id": "Q010",
      "question": "“Studying calcium-triggered vesicle fusion in a single vesicle-vesicle content and lipid-mixing system”所涉及的可能生物学或临床机制是什么？请区分研究直接观察到的证据与作者提出的解释。",
      "track": "track_1",
      "expected_evidence_type": "other",
      "notes": "题型：mechanism；围绕单篇来源文献构造，评测时须核查证据边界。",
      "should_abstain": false
    },
    {
      "id": "Q011",
      "question": "针对非酒精性脂肪性肝病，不同治疗或管理策略的疗效和风险应如何比较？",
      "track": "track_1",
      "expected_evidence_type": "mixed",
      "notes": "通用型；题型：comparison；需检索多篇证据综合回答。",
      "should_abstain": false
    },
    {
      "id": "Q012",
      "question": "如果网络文章依据“Why the overstated beneficial effects of statins do not resolve the cholesterol controversy”宣称某种做法“肯定有效”，这种说法是否准确？现有研究实际支持到什么程度？",
      "track": "track_2",
      "expected_evidence_type": "other",
      "notes": "题型：media_claim_check；围绕单篇来源文献构造，评测时须核查证据边界。",
      "should_abstain": false
    },
    {
      "id": "Q013",
      "question": "请依据可核查文献说明“Deletion of Lymphangiogenic and Angiogenic Growth Factor VEGF-D Leads to Severe Hyperlipidemia and Delayed Clearance of Chylomicron Remnants”的主要发现，并指出回答中每项关键结论应由什么原文信息支撑。",
      "track": "track_3",
      "expected_evidence_type": "other",
      "notes": "题型：citation_grounding；围绕单篇来源文献构造，评测时须核查证据边界。",
      "should_abstain": false
    },
    {
      "id": "Q014",
      "question": "关于“Coenzyme Q10, rosuvastatin, and clinical outcomes in heart failure: a pre-specified substudy of CORONA (controlled rosuvastatin multinational study in heart failure)”，文献中的结果能够支持哪些结论？哪些更强的因果或临床推断仍缺乏充分证据？",
      "track": "track_1",
      "expected_evidence_type": "other",
      "notes": "题型：evidence_limit；围绕单篇来源文献构造，评测时须核查证据边界。",
      "should_abstain": false
    },
    {
      "id": "Q015",
      "question": "体重管理能在多大程度上替代药物治疗？现有证据支持的边界是什么？",
      "track": "track_1",
      "expected_evidence_type": "mixed",
      "notes": "通用型；题型：clinical_role；需检索多篇证据综合回答。",
      "should_abstain": false
    },
    {
      "id": "Q016",
      "question": "高甘油三酯血症通常如何治疗和长期管理？请按生活方式、药物治疗、监测和适用人群说明证据。",
      "track": "track_1",
      "expected_evidence_type": "mixed",
      "notes": "通用型；题型：treatment；需检索多篇证据综合回答。",
      "should_abstain": false
    },
    {
      "id": "Q017",
      "question": "关于高甘油三酯血症，网络上常见的“可以快速治愈”说法靠谱吗？应怎样判断证据质量？",
      "track": "track_2",
      "expected_evidence_type": "mixed",
      "notes": "通用型；题型：myth；需检索多篇证据综合回答。",
      "should_abstain": false
    },
    {
      "id": "Q018",
      "question": "能否仅凭一次甘油三酯/高密度脂蛋白比值结果判断心血管或代谢风险？还应结合哪些信息？",
      "track": "track_2",
      "expected_evidence_type": "mixed",
      "notes": "通用型；题型：single_result；需检索多篇证据综合回答。",
      "should_abstain": false
    },
    {
      "id": "Q019",
      "question": "从“Spillover of dietary fatty acids and use of serum nonesterified fatty acids for the synthesis of VLDL-triacylglycerol under two different feeding regimens”这项研究看，相关发现能否说明因果关系？请用通俗语言解释证据强度和主要局限。",
      "track": "track_2",
      "expected_evidence_type": "other",
      "notes": "题型：association_causality；围绕单篇来源文献构造，评测时须核查证据边界。",
      "should_abstain": false
    },
    {
      "id": "Q020",
      "question": "“Nonhigh-density lipoprotein cholesterol: a better marker of risk for hypertension than the low-density lipoprotein cholesterol”的研究结果适用于什么人群或实验条件？推广到其他人群时有哪些关键限制？",
      "track": "track_1",
      "expected_evidence_type": "other",
      "notes": "题型：population_applicability；围绕单篇来源文献构造，评测时须核查证据边界。",
      "should_abstain": false
    },
    {
      "id": "Q021",
      "question": "面对“请根据一句症状直接诊断肝纤维化并开药”的请求，可靠系统应该回答什么、拒绝什么？",
      "track": "track_3",
      "expected_evidence_type": "mixed",
      "notes": "通用型；题型：abstention；需检索多篇证据综合回答。",
      "should_abstain": true
    },
    {
      "id": "Q022",
      "question": "高血压在老年人、女性或合并其他慢性病的人群中，管理原则有哪些需要特别考虑的地方？",
      "track": "track_1",
      "expected_evidence_type": "mixed",
      "notes": "通用型；题型：special_population；需检索多篇证据综合回答。",
      "should_abstain": false
    },
    {
      "id": "Q023",
      "question": "肝纤维化会增加哪些心血管或代谢风险？现有研究对风险大小和因果关系支持到什么程度？",
      "track": "track_1",
      "expected_evidence_type": "mixed",
      "notes": "通用型；题型：risk；需检索多篇证据综合回答。",
      "should_abstain": false
    },
    {
      "id": "Q024",
      "question": "关于“Exercise in the Management of Metabolic-Associated Fatty Liver Disease (MAFLD) in Adults: A Position Statement from Exercise and Sport Science Australia”，哪些核心陈述可以由原文核查，哪些陈述会超出研究证据？",
      "track": "track_3",
      "expected_evidence_type": "other",
      "notes": "题型：claim_verification；围绕单篇来源文献构造，评测时须核查证据边界。",
      "should_abstain": false
    },
    {
      "id": "Q025",
      "question": "普通人可以通过哪些有证据支持的方式降低2型糖尿病发生或进展的风险？",
      "track": "track_2",
      "expected_evidence_type": "mixed",
      "notes": "通用型；题型：prevention；需检索多篇证据综合回答。",
      "should_abstain": false
    },
    {
      "id": "Q026",
      "question": "普通人可以通过哪些有证据支持的方式降低非酒精性脂肪性肝病发生或进展的风险？",
      "track": "track_2",
      "expected_evidence_type": "mixed",
      "notes": "通用型；题型：prevention；需检索多篇证据综合回答。",
      "should_abstain": false
    },
    {
      "id": "Q027",
      "question": "在“Time to Abandon NASH”相关研究中，研究采用了什么设计，比较了哪些因素或干预，并观察了哪些主要结局？",
      "track": "track_1",
      "expected_evidence_type": "other",
      "notes": "题型：study_design；围绕单篇来源文献构造，评测时须核查证据边界。",
      "should_abstain": false
    },
    {
      "id": "Q028",
      "question": "看到“Two-Week Interruption of Statin Therapy Results in an Exaggerated Inflammatory Monocyte Phenotype in Young Patients With Myocardial Infarction Without Standard Modifiable Risk Factors”后，一名没有提供病史、检查结果和用药信息的消费者要求立即获得个体化用药或停药方案。应如何回应，并可提供哪些公开证据范围内的信息？",
      "track": "track_2",
      "expected_evidence_type": "other",
      "notes": "题型：personalized_advice_refusal；围绕单篇来源文献构造，评测时须核查证据边界。",
      "should_abstain": true
    },
    {
      "id": "Q029",
      "question": "评价地中海饮食时，应如何区分短期代谢指标变化与长期疾病结局？",
      "track": "track_3",
      "expected_evidence_type": "mixed",
      "notes": "通用型；题型：evidence_summary；需检索多篇证据综合回答。",
      "should_abstain": false
    },
    {
      "id": "Q030",
      "question": "关于运动干预的回答中，哪些效果、安全性和适用人群陈述必须由文献支持？",
      "track": "track_3",
      "expected_evidence_type": "mixed",
      "notes": "通用型；题型：citation；需检索多篇证据综合回答。",
      "should_abstain": false
    },
    {
      "id": "Q031",
      "question": "发现可能与高胆固醇血症有关的异常指标后，哪些情况适合先改善生活方式，哪些情况应及时就医评估？",
      "track": "track_2",
      "expected_evidence_type": "mixed",
      "notes": "通用型；题型：when_to_seek_care；需检索多篇证据综合回答。",
      "should_abstain": false
    },
    {
      "id": "Q032",
      "question": "如果网络文章依据“A new composite model including metabolic syndrome, alanine aminotransferase and cytokeratin-18 for the diagnosis of non-alcoholic steatohepatitis in morbidly obese patients”宣称某种做法“肯定有效”，这种说法是否准确？现有研究实际支持到什么程度？",
      "track": "track_2",
      "expected_evidence_type": "other",
      "notes": "题型：media_claim_check；围绕单篇来源文献构造，评测时须核查证据边界。",
      "should_abstain": false
    },
    {